error_code,error_message,timestamp,source,severity,user_id,device_type,location,resolution_time,resolved_by
478,"Morbi vestibulum, velit id pretium iaculis, diam erat fermentum justo, nec condimentum neque sapien placerat ante.",11/8/2024,client,high,264,desktop,3223 Daystar Drive,174,Berk Grishagin
139,"Proin risus. Praesent lectus. Vestibulum quam sapien, varius ut, blandit non, interdum in, ante. Vestibulum ante ipsum primis in faucibus orci luctus et ultrices posuere cubilia Curae; Duis faucibus accumsan odio.",10/6/2024,server,medium,265,mobile,236 Russell Alley,359,Hattie Brayford
413,In hac habitasse platea dictumst. Etiam faucibus cursus urna. Ut tellus. Nulla ut erat id mauris vulputate elementum. Nullam varius.,5/17/2024,client,low,266,mobile,083 Gerald Point,1190,Verna Vesque
148,Vivamus in felis eu sapien cursus vestibulum.,4/28/2024,server,medium,267,desktop,31 Evergreen Parkway,1279,Jerrome Matushevitz
532,"Suspendisse potenti. Nullam porttitor lacus at turpis. Donec posuere metus vitae ipsum. Aliquam non mauris. Morbi non lectus. Aliquam sit amet diam in magna bibendum imperdiet. Nullam orci pede, venenatis non, sodales sed, tincidunt eu, felis. Fusce posuere felis sed lacus.",1/2/2024,client,medium,268,mobile,654 Northfield Hill,559,Brenden Jobbings
958,"Pellentesque at nulla. Suspendisse potenti. Cras in purus eu magna vulputate luctus. Cum sociis natoque penatibus et magnis dis parturient montes, nascetur ridiculus mus. Vivamus vestibulum sagittis sapien. Cum sociis natoque penatibus et magnis dis parturient montes, nascetur ridiculus mus. Etiam vel augue.",7/15/2024,client,medium,269,mobile,7771 Maple Wood Alley,513,Lyndsey Kinane
939,"Nam ultrices, libero non mattis pulvinar, nulla pede ullamcorper augue, a suscipit nulla elit ac nulla.",1/22/2024,database,low,270,desktop,90 Monterey Plaza,272,Adan de Castelain
616,"Praesent blandit. Nam nulla. Integer pede justo, lacinia eget, tincidunt eget, tempus vel, pede. Morbi porttitor lorem id ligula. Suspendisse ornare consequat lectus. In est risus, auctor sed, tristique in, tempus sit amet, sem. Fusce consequat. Nulla nisl. Nunc nisl. Duis bibendum, felis sed interdum venenatis, turpis enim blandit mi, in porttitor pede justo eu massa.",3/25/2024,client,medium,271,mobile,099 Blackbird Court,201,Karoline Stuchbery
803,"Pellentesque ultrices mattis odio. Donec vitae nisi. Nam ultrices, libero non mattis pulvinar, nulla pede ullamcorper augue, a suscipit nulla elit ac nulla.",8/16/2024,database,medium,272,tablet,924 Northview Alley,621,Rose Langeley
872,"Vestibulum ante ipsum primis in faucibus orci luctus et ultrices posuere cubilia Curae; Duis faucibus accumsan odio. Curabitur convallis. Duis consequat dui nec nisi volutpat eleifend. Donec ut dolor. Morbi vel lectus in quam fringilla rhoncus. Mauris enim leo, rhoncus sed, vestibulum sit amet, cursus id, turpis. Integer aliquet, massa id lobortis convallis, tortor risus dapibus augue, vel accumsan tellus nisi eu orci. Mauris lacinia sapien quis libero. Nullam sit amet turpis elementum ligula vehicula consequat.",11/12/2023,server,medium,273,desktop,81903 Dryden Junction,1436,Barbabra Mollatt
348,Nulla justo. Aliquam quis turpis eget elit sodales scelerisque. Mauris sit amet eros. Suspendisse accumsan tortor quis turpis.,10/21/2024,client,medium,274,desktop,6 Barby Trail,758,Emelyne O'Sherrin
315,"Aliquam non mauris. Morbi non lectus. Aliquam sit amet diam in magna bibendum imperdiet. Nullam orci pede, venenatis non, sodales sed, tincidunt eu, felis. Fusce posuere felis sed lacus. Morbi sem mauris, laoreet ut, rhoncus aliquet, pulvinar sed, nisl. Nunc rhoncus dui vel sem.",1/24/2024,server,low,275,desktop,9776 Marquette Drive,1362,Des Sahlstrom
620,"In tempor, turpis nec euismod scelerisque, quam turpis adipiscing lorem, vitae mattis nibh ligula nec sem.",2/19/2024,client,medium,276,tablet,6559 Mcbride Crossing,869,Harold Hollyer
632,"Vestibulum ante ipsum primis in faucibus orci luctus et ultrices posuere cubilia Curae; Donec pharetra, magna vestibulum aliquet ultrices, erat tortor sollicitudin mi, sit amet lobortis sapien sapien non mi. Integer ac neque. Duis bibendum. Morbi non quam nec dui luctus rutrum. Nulla tellus. In sagittis dui vel nisl. Duis ac nibh. Fusce lacus purus, aliquet at, feugiat non, pretium quis, lectus.",11/3/2023,database,medium,277,mobile,799 Linden Road,1123,Berty Frankish
967,"Nullam orci pede, venenatis non, sodales sed, tincidunt eu, felis. Fusce posuere felis sed lacus. Morbi sem mauris, laoreet ut, rhoncus aliquet, pulvinar sed, nisl. Nunc rhoncus dui vel sem. Sed sagittis. Nam congue, risus semper porta volutpat, quam pede lobortis ligula, sit amet eleifend pede libero quis orci. Nullam molestie nibh in lectus. Pellentesque at nulla.",6/14/2024,client,medium,278,tablet,6 Carey Park,856,Holt Luesley
156,"Aenean auctor gravida sem. Praesent id massa id nisl venenatis lacinia. Aenean sit amet justo. Morbi ut odio. Cras mi pede, malesuada in, imperdiet et, commodo vulputate, justo. In blandit ultrices enim. Lorem ipsum dolor sit amet, consectetuer adipiscing elit. Proin interdum mauris non ligula pellentesque ultrices. Phasellus id sapien in sapien iaculis congue.",9/28/2024,database,medium,279,tablet,06022 Elmside Terrace,1277,Robbin Shier
750,Cras non velit nec nisi vulputate nonummy. Maecenas tincidunt lacus at velit. Vivamus vel nulla eget eros elementum pellentesque.,8/23/2024,client,low,280,tablet,47 Larry Road,810,Janeva Batecok
464,Nulla tellus. In sagittis dui vel nisl. Duis ac nibh.,12/3/2023,server,medium,281,mobile,67 Schurz Drive,1302,Batsheva Burgne
870,"Proin eu mi. Nulla ac enim. In tempor, turpis nec euismod scelerisque, quam turpis adipiscing lorem, vitae mattis nibh ligula nec sem. Duis aliquam convallis nunc. Proin at turpis a pede posuere nonummy. Integer non velit. Donec diam neque, vestibulum eget, vulputate ut, ultrices vel, augue. Vestibulum ante ipsum primis in faucibus orci luctus et ultrices posuere cubilia Curae; Donec pharetra, magna vestibulum aliquet ultrices, erat tortor sollicitudin mi, sit amet lobortis sapien sapien non mi.",3/28/2024,client,low,282,mobile,1149 Homewood Avenue,850,Elane Lathom
469,"Morbi vestibulum, velit id pretium iaculis, diam erat fermentum justo, nec condimentum neque sapien placerat ante. Nulla justo. Aliquam quis turpis eget elit sodales scelerisque. Mauris sit amet eros. Suspendisse accumsan tortor quis turpis. Sed ante. Vivamus tortor. Duis mattis egestas metus. Aenean fermentum. Donec ut mauris eget massa tempor convallis.",11/10/2024,client,high,283,desktop,30855 Clarendon Place,976,Tabor Schulze
824,"Aenean lectus. Pellentesque eget nunc. Donec quis orci eget orci vehicula condimentum. Curabitur in libero ut massa volutpat convallis. Morbi odio odio, elementum eu, interdum eu, tincidunt in, leo. Maecenas pulvinar lobortis est. Phasellus sit amet erat.",11/18/2023,database,medium,284,desktop,4617 Hovde Avenue,271,Bowie Babin
202,Integer ac neque. Duis bibendum. Morbi non quam nec dui luctus rutrum.,10/16/2024,client,low,285,tablet,1288 Sunnyside Park,823,Lowrance Meiner
633,"Vestibulum quam sapien, varius ut, blandit non, interdum in, ante. Vestibulum ante ipsum primis in faucibus orci luctus et ultrices posuere cubilia Curae; Duis faucibus accumsan odio.",11/17/2023,client,low,286,mobile,322 Clarendon Crossing,472,Onida De Carlo
293,"Cum sociis natoque penatibus et magnis dis parturient montes, nascetur ridiculus mus.",11/3/2023,server,high,287,tablet,1059 Katie Plaza,987,Humphrey Beelby
876,Aliquam quis turpis eget elit sodales scelerisque. Mauris sit amet eros. Suspendisse accumsan tortor quis turpis. Sed ante. Vivamus tortor. Duis mattis egestas metus. Aenean fermentum.,2/21/2024,database,medium,288,mobile,61073 Meadow Vale Avenue,232,Maynord Dryden
435,"Morbi quis tortor id nulla ultrices aliquet. Maecenas leo odio, condimentum id, luctus nec, molestie sed, justo. Pellentesque viverra pede ac diam. Cras pellentesque volutpat dui. Maecenas tristique, est et tempus semper, est quam pharetra magna, ac consequat metus sapien ut nunc. Vestibulum ante ipsum primis in faucibus orci luctus et ultrices posuere cubilia Curae; Mauris viverra diam vitae quam.",11/21/2023,client,medium,289,tablet,780 Crest Line Crossing,172,Penny Romi
894,"In hac habitasse platea dictumst. Maecenas ut massa quis augue luctus tincidunt. Nulla mollis molestie lorem. Quisque ut erat. Curabitur gravida nisi at nibh. In hac habitasse platea dictumst. Aliquam augue quam, sollicitudin vitae, consectetuer eget, rutrum at, lorem. Integer tincidunt ante vel ipsum. Praesent blandit lacinia erat. Vestibulum sed magna at nunc commodo placerat.",5/30/2024,server,medium,290,mobile,4664 Village Green Center,259,Emiline Tumpane
403,"Fusce congue, diam id ornare imperdiet, sapien urna pretium nisl, ut volutpat sapien arcu sed augue. Aliquam erat volutpat. In congue.",8/27/2024,server,low,291,desktop,716 Mitchell Point,1212,Benedetto Musto
989,"Nam nulla. Integer pede justo, lacinia eget, tincidunt eget, tempus vel, pede.",3/4/2024,database,low,292,desktop,576 Everett Street,904,Joanne Santo
799,"Curabitur convallis. Duis consequat dui nec nisi volutpat eleifend. Donec ut dolor. Morbi vel lectus in quam fringilla rhoncus. Mauris enim leo, rhoncus sed, vestibulum sit amet, cursus id, turpis. Integer aliquet, massa id lobortis convallis, tortor risus dapibus augue, vel accumsan tellus nisi eu orci. Mauris lacinia sapien quis libero. Nullam sit amet turpis elementum ligula vehicula consequat.",10/4/2023,server,medium,293,desktop,84116 Ryan Terrace,224,Brittni Ricca
452,"Nulla tellus. In sagittis dui vel nisl. Duis ac nibh. Fusce lacus purus, aliquet at, feugiat non, pretium quis, lectus. Suspendisse potenti. In eleifend quam a odio. In hac habitasse platea dictumst.",11/4/2023,database,high,294,mobile,44609 Dayton Lane,495,Dorothea Schistl
525,Aliquam quis turpis eget elit sodales scelerisque. Mauris sit amet eros. Suspendisse accumsan tortor quis turpis. Sed ante. Vivamus tortor. Duis mattis egestas metus.,10/29/2024,client,high,295,desktop,80198 Ridgeview Trail,1276,Bryn Hatherley
928,"Praesent blandit. Nam nulla. Integer pede justo, lacinia eget, tincidunt eget, tempus vel, pede. Morbi porttitor lorem id ligula. Suspendisse ornare consequat lectus. In est risus, auctor sed, tristique in, tempus sit amet, sem. Fusce consequat.",5/27/2024,client,medium,296,mobile,55 Meadow Vale Pass,740,Marcelline Greasty
627,In hac habitasse platea dictumst.,4/11/2024,database,medium,297,mobile,509 Katie Court,338,Kareem Ezzy
982,"Nulla nisl. Nunc nisl. Duis bibendum, felis sed interdum venenatis, turpis enim blandit mi, in porttitor pede justo eu massa. Donec dapibus.",6/30/2024,database,high,298,desktop,0245 Straubel Point,356,Sullivan Scurry
318,"Nam nulla. Integer pede justo, lacinia eget, tincidunt eget, tempus vel, pede. Morbi porttitor lorem id ligula. Suspendisse ornare consequat lectus. In est risus, auctor sed, tristique in, tempus sit amet, sem.",8/4/2024,server,high,299,mobile,95 Riverside Alley,85,Caressa Heinrich
604,"Nullam porttitor lacus at turpis. Donec posuere metus vitae ipsum. Aliquam non mauris. Morbi non lectus. Aliquam sit amet diam in magna bibendum imperdiet. Nullam orci pede, venenatis non, sodales sed, tincidunt eu, felis. Fusce posuere felis sed lacus. Morbi sem mauris, laoreet ut, rhoncus aliquet, pulvinar sed, nisl. Nunc rhoncus dui vel sem. Sed sagittis.",3/24/2024,database,high,300,desktop,6 Porter Drive,472,Nana Baszkiewicz
143,"Morbi sem mauris, laoreet ut, rhoncus aliquet, pulvinar sed, nisl. Nunc rhoncus dui vel sem. Sed sagittis. Nam congue, risus semper porta volutpat, quam pede lobortis ligula, sit amet eleifend pede libero quis orci. Nullam molestie nibh in lectus. Pellentesque at nulla. Suspendisse potenti. Cras in purus eu magna vulputate luctus. Cum sociis natoque penatibus et magnis dis parturient montes, nascetur ridiculus mus.",1/14/2024,database,high,301,tablet,29825 Killdeer Plaza,902,Arnoldo Ellershaw
444,"Vivamus metus arcu, adipiscing molestie, hendrerit at, vulputate vitae, nisl.",10/11/2023,server,low,302,mobile,96621 Homewood Avenue,787,Francisco Cornier
182,Ut tellus. Nulla ut erat id mauris vulputate elementum. Nullam varius.,5/20/2024,database,low,303,tablet,313 Hallows Park,177,Brynne O'Fallone
257,"Suspendisse potenti. Nullam porttitor lacus at turpis. Donec posuere metus vitae ipsum. Aliquam non mauris. Morbi non lectus. Aliquam sit amet diam in magna bibendum imperdiet. Nullam orci pede, venenatis non, sodales sed, tincidunt eu, felis. Fusce posuere felis sed lacus.",9/6/2024,database,high,304,mobile,1 Jackson Parkway,124,Vere Ibbitson
973,"Morbi quis tortor id nulla ultrices aliquet. Maecenas leo odio, condimentum id, luctus nec, molestie sed, justo. Pellentesque viverra pede ac diam. Cras pellentesque volutpat dui. Maecenas tristique, est et tempus semper, est quam pharetra magna, ac consequat metus sapien ut nunc. Vestibulum ante ipsum primis in faucibus orci luctus et ultrices posuere cubilia Curae; Mauris viverra diam vitae quam. Suspendisse potenti. Nullam porttitor lacus at turpis. Donec posuere metus vitae ipsum. Aliquam non mauris.",10/7/2024,database,low,305,desktop,81158 Jay Terrace,902,Allister Tinkler
343,Cras non velit nec nisi vulputate nonummy. Maecenas tincidunt lacus at velit.,8/18/2024,database,medium,306,desktop,271 Weeping Birch Point,757,Worthington Griffin
548,"Nunc nisl. Duis bibendum, felis sed interdum venenatis, turpis enim blandit mi, in porttitor pede justo eu massa. Donec dapibus. Duis at velit eu est congue elementum. In hac habitasse platea dictumst. Morbi vestibulum, velit id pretium iaculis, diam erat fermentum justo, nec condimentum neque sapien placerat ante. Nulla justo. Aliquam quis turpis eget elit sodales scelerisque. Mauris sit amet eros. Suspendisse accumsan tortor quis turpis.",12/31/2023,database,medium,307,desktop,0 Erie Point,528,Julee Olin
632,"Lorem ipsum dolor sit amet, consectetuer adipiscing elit. Proin interdum mauris non ligula pellentesque ultrices. Phasellus id sapien in sapien iaculis congue. Vivamus metus arcu, adipiscing molestie, hendrerit at, vulputate vitae, nisl. Aenean lectus. Pellentesque eget nunc. Donec quis orci eget orci vehicula condimentum. Curabitur in libero ut massa volutpat convallis. Morbi odio odio, elementum eu, interdum eu, tincidunt in, leo.",4/18/2024,database,medium,308,tablet,345 Transport Terrace,663,Brittney Nelle
432,Sed ante. Vivamus tortor. Duis mattis egestas metus.,4/29/2024,server,high,309,mobile,7 Truax Avenue,819,Sydney Lightwing
802,Nulla justo. Aliquam quis turpis eget elit sodales scelerisque. Mauris sit amet eros. Suspendisse accumsan tortor quis turpis.,4/24/2024,database,high,310,desktop,80003 Superior Park,740,Bone Gooly
993,"Donec ut mauris eget massa tempor convallis. Nulla neque libero, convallis eget, eleifend luctus, ultricies eu, nibh. Quisque id justo sit amet sapien dignissim vestibulum. Vestibulum ante ipsum primis in faucibus orci luctus et ultrices posuere cubilia Curae; Nulla dapibus dolor vel est. Donec odio justo, sollicitudin ut, suscipit a, feugiat et, eros. Vestibulum ac est lacinia nisi venenatis tristique. Fusce congue, diam id ornare imperdiet, sapien urna pretium nisl, ut volutpat sapien arcu sed augue. Aliquam erat volutpat.",1/9/2024,client,high,311,tablet,98 Heffernan Lane,287,Piotr Gaydon
423,"Fusce congue, diam id ornare imperdiet, sapien urna pretium nisl, ut volutpat sapien arcu sed augue.",9/21/2024,server,high,312,desktop,5788 Waywood Junction,808,Ingar Gelly
742,"Vivamus in felis eu sapien cursus vestibulum. Proin eu mi. Nulla ac enim. In tempor, turpis nec euismod scelerisque, quam turpis adipiscing lorem, vitae mattis nibh ligula nec sem. Duis aliquam convallis nunc. Proin at turpis a pede posuere nonummy.",8/26/2024,database,high,313,desktop,832 Park Meadow Avenue,1105,Thorny Roseborough
207,"Cras mi pede, malesuada in, imperdiet et, commodo vulputate, justo. In blandit ultrices enim. Lorem ipsum dolor sit amet, consectetuer adipiscing elit. Proin interdum mauris non ligula pellentesque ultrices.",5/3/2024,database,high,314,mobile,0 Magdeline Hill,25,Peirce Daffey
169,"Aliquam augue quam, sollicitudin vitae, consectetuer eget, rutrum at, lorem. Integer tincidunt ante vel ipsum. Praesent blandit lacinia erat. Vestibulum sed magna at nunc commodo placerat. Praesent blandit. Nam nulla. Integer pede justo, lacinia eget, tincidunt eget, tempus vel, pede. Morbi porttitor lorem id ligula. Suspendisse ornare consequat lectus.",8/26/2024,database,low,315,desktop,8 Bluejay Avenue,18,Domingo Eastes
146,"Aenean fermentum. Donec ut mauris eget massa tempor convallis. Nulla neque libero, convallis eget, eleifend luctus, ultricies eu, nibh. Quisque id justo sit amet sapien dignissim vestibulum. Vestibulum ante ipsum primis in faucibus orci luctus et ultrices posuere cubilia Curae; Nulla dapibus dolor vel est. Donec odio justo, sollicitudin ut, suscipit a, feugiat et, eros. Vestibulum ac est lacinia nisi venenatis tristique. Fusce congue, diam id ornare imperdiet, sapien urna pretium nisl, ut volutpat sapien arcu sed augue.",7/19/2024,server,medium,316,mobile,4950 Vera Trail,971,Tam Ambrozik
714,"Aenean lectus. Pellentesque eget nunc. Donec quis orci eget orci vehicula condimentum. Curabitur in libero ut massa volutpat convallis. Morbi odio odio, elementum eu, interdum eu, tincidunt in, leo. Maecenas pulvinar lobortis est. Phasellus sit amet erat. Nulla tempus. Vivamus in felis eu sapien cursus vestibulum. Proin eu mi.",3/15/2024,server,low,317,mobile,202 Fallview Road,1300,Billi Studart
170,"Maecenas tincidunt lacus at velit. Vivamus vel nulla eget eros elementum pellentesque. Quisque porta volutpat erat. Quisque erat eros, viverra eget, congue eget, semper rutrum, nulla.",3/31/2024,client,high,318,desktop,8964 Starling Drive,1260,Hurley Kattenhorn
505,"Morbi vestibulum, velit id pretium iaculis, diam erat fermentum justo, nec condimentum neque sapien placerat ante. Nulla justo. Aliquam quis turpis eget elit sodales scelerisque. Mauris sit amet eros. Suspendisse accumsan tortor quis turpis. Sed ante.",1/17/2024,client,high,319,desktop,7465 Rusk Parkway,562,Oralle Burchill
200,"Nullam porttitor lacus at turpis. Donec posuere metus vitae ipsum. Aliquam non mauris. Morbi non lectus. Aliquam sit amet diam in magna bibendum imperdiet. Nullam orci pede, venenatis non, sodales sed, tincidunt eu, felis. Fusce posuere felis sed lacus. Morbi sem mauris, laoreet ut, rhoncus aliquet, pulvinar sed, nisl. Nunc rhoncus dui vel sem.",12/21/2023,server,low,320,tablet,97331 Thackeray Terrace,207,Erek Venners
546,Aenean lectus. Pellentesque eget nunc.,3/11/2024,client,low,321,mobile,6988 Mendota Place,253,Eustacia Anniwell
526,"Morbi non quam nec dui luctus rutrum. Nulla tellus. In sagittis dui vel nisl. Duis ac nibh. Fusce lacus purus, aliquet at, feugiat non, pretium quis, lectus. Suspendisse potenti.",5/16/2024,client,high,322,mobile,89034 Continental Center,834,Kelly Pagnin
276,Aliquam erat volutpat. In congue. Etiam justo. Etiam pretium iaculis justo. In hac habitasse platea dictumst. Etiam faucibus cursus urna. Ut tellus.,11/12/2024,server,medium,323,desktop,01954 Anzinger Terrace,380,Stefan Pridmore
965,In hac habitasse platea dictumst.,8/1/2024,client,low,324,desktop,27201 Gina Center,1201,Grazia Ghilardini
243,"Nullam porttitor lacus at turpis. Donec posuere metus vitae ipsum. Aliquam non mauris. Morbi non lectus. Aliquam sit amet diam in magna bibendum imperdiet. Nullam orci pede, venenatis non, sodales sed, tincidunt eu, felis.",11/4/2023,server,medium,325,desktop,7375 Bashford Circle,143,Denny Grellier
277,"In est risus, auctor sed, tristique in, tempus sit amet, sem. Fusce consequat.",11/5/2024,database,medium,326,mobile,6 Hayes Point,241,Sheffy Tomaini
536,"Proin leo odio, porttitor id, consequat in, consequat ut, nulla. Sed accumsan felis. Ut at dolor quis odio consequat varius. Integer ac leo. Pellentesque ultrices mattis odio. Donec vitae nisi. Nam ultrices, libero non mattis pulvinar, nulla pede ullamcorper augue, a suscipit nulla elit ac nulla. Sed vel enim sit amet nunc viverra dapibus.",4/22/2024,server,low,327,tablet,3154 Morning Way,205,Shaun Grigoliis
983,Phasellus sit amet erat.,12/12/2023,client,low,328,desktop,51757 Morning Drive,1073,Jeanine Creak
699,"Vestibulum quam sapien, varius ut, blandit non, interdum in, ante. Vestibulum ante ipsum primis in faucibus orci luctus et ultrices posuere cubilia Curae; Duis faucibus accumsan odio.",11/6/2023,client,low,329,desktop,79810 Carpenter Avenue,1428,Arly Hacquoil
118,"Quisque porta volutpat erat. Quisque erat eros, viverra eget, congue eget, semper rutrum, nulla. Nunc purus. Phasellus in felis. Donec semper sapien a libero. Nam dui. Proin leo odio, porttitor id, consequat in, consequat ut, nulla. Sed accumsan felis. Ut at dolor quis odio consequat varius.",10/8/2024,client,high,330,mobile,62 Arizona Parkway,952,Giulia Buttle
175,"Morbi sem mauris, laoreet ut, rhoncus aliquet, pulvinar sed, nisl. Nunc rhoncus dui vel sem. Sed sagittis. Nam congue, risus semper porta volutpat, quam pede lobortis ligula, sit amet eleifend pede libero quis orci. Nullam molestie nibh in lectus. Pellentesque at nulla. Suspendisse potenti. Cras in purus eu magna vulputate luctus. Cum sociis natoque penatibus et magnis dis parturient montes, nascetur ridiculus mus. Vivamus vestibulum sagittis sapien.",6/21/2024,client,medium,331,tablet,28538 Rowland Hill,635,Nonna Kneeland
973,"Sed sagittis. Nam congue, risus semper porta volutpat, quam pede lobortis ligula, sit amet eleifend pede libero quis orci. Nullam molestie nibh in lectus. Pellentesque at nulla. Suspendisse potenti.",10/20/2023,server,low,332,mobile,5 Oakridge Road,377,Lemuel McCaster
409,"Nam dui. Proin leo odio, porttitor id, consequat in, consequat ut, nulla. Sed accumsan felis. Ut at dolor quis odio consequat varius. Integer ac leo.",2/27/2024,server,low,333,mobile,9 Transport Plaza,1289,Kevin Nial
426,Ut tellus.,6/16/2024,database,medium,334,desktop,223 Mandrake Alley,258,Raymond Deetch
862,Pellentesque eget nunc. Donec quis orci eget orci vehicula condimentum.,12/16/2023,server,low,335,tablet,2000 Beilfuss Drive,850,Lindie Londing
414,"Vivamus in felis eu sapien cursus vestibulum. Proin eu mi. Nulla ac enim. In tempor, turpis nec euismod scelerisque, quam turpis adipiscing lorem, vitae mattis nibh ligula nec sem. Duis aliquam convallis nunc. Proin at turpis a pede posuere nonummy.",4/14/2024,database,high,336,desktop,0430 Pond Way,998,Orly Poure
100,"Morbi porttitor lorem id ligula. Suspendisse ornare consequat lectus. In est risus, auctor sed, tristique in, tempus sit amet, sem. Fusce consequat. Nulla nisl. Nunc nisl. Duis bibendum, felis sed interdum venenatis, turpis enim blandit mi, in porttitor pede justo eu massa. Donec dapibus. Duis at velit eu est congue elementum.",7/6/2024,database,medium,337,tablet,6 Kim Alley,492,Bobbee Greason
269,Nulla facilisi. Cras non velit nec nisi vulputate nonummy.,11/4/2024,client,high,338,desktop,36438 Express Place,1264,Florentia Cawson
333,"Fusce posuere felis sed lacus. Morbi sem mauris, laoreet ut, rhoncus aliquet, pulvinar sed, nisl. Nunc rhoncus dui vel sem. Sed sagittis. Nam congue, risus semper porta volutpat, quam pede lobortis ligula, sit amet eleifend pede libero quis orci. Nullam molestie nibh in lectus.",12/9/2023,client,medium,339,desktop,1 Union Court,381,Flinn Henrys
970,"Fusce lacus purus, aliquet at, feugiat non, pretium quis, lectus. Suspendisse potenti. In eleifend quam a odio. In hac habitasse platea dictumst. Maecenas ut massa quis augue luctus tincidunt. Nulla mollis molestie lorem. Quisque ut erat. Curabitur gravida nisi at nibh.",11/6/2024,client,high,340,tablet,4882 Johnson Alley,907,Ansell Dowdle
950,"Nullam varius. Nulla facilisi. Cras non velit nec nisi vulputate nonummy. Maecenas tincidunt lacus at velit. Vivamus vel nulla eget eros elementum pellentesque. Quisque porta volutpat erat. Quisque erat eros, viverra eget, congue eget, semper rutrum, nulla. Nunc purus. Phasellus in felis. Donec semper sapien a libero.",9/28/2024,server,medium,341,mobile,36254 Rowland Parkway,1390,Cherri Beeble
323,"Vivamus in felis eu sapien cursus vestibulum. Proin eu mi. Nulla ac enim. In tempor, turpis nec euismod scelerisque, quam turpis adipiscing lorem, vitae mattis nibh ligula nec sem. Duis aliquam convallis nunc. Proin at turpis a pede posuere nonummy. Integer non velit. Donec diam neque, vestibulum eget, vulputate ut, ultrices vel, augue. Vestibulum ante ipsum primis in faucibus orci luctus et ultrices posuere cubilia Curae; Donec pharetra, magna vestibulum aliquet ultrices, erat tortor sollicitudin mi, sit amet lobortis sapien sapien non mi. Integer ac neque.",5/29/2024,database,high,342,desktop,25688 Heffernan Drive,1267,Giorgi Frany
225,"Nam ultrices, libero non mattis pulvinar, nulla pede ullamcorper augue, a suscipit nulla elit ac nulla. Sed vel enim sit amet nunc viverra dapibus. Nulla suscipit ligula in lacus. Curabitur at ipsum ac tellus semper interdum. Mauris ullamcorper purus sit amet nulla. Quisque arcu libero, rutrum ac, lobortis vel, dapibus at, diam. Nam tristique tortor eu pede.",10/2/2023,database,high,343,mobile,0224 Linden Street,480,Anthe Ebbage
298,In hac habitasse platea dictumst. Etiam faucibus cursus urna.,8/16/2024,server,low,344,mobile,009 Magdeline Street,90,Lorenza Egell
452,"Morbi vestibulum, velit id pretium iaculis, diam erat fermentum justo, nec condimentum neque sapien placerat ante. Nulla justo. Aliquam quis turpis eget elit sodales scelerisque. Mauris sit amet eros.",8/2/2024,server,medium,345,desktop,00 Stone Corner Park,941,Rollie Ragsdall
531,Ut tellus. Nulla ut erat id mauris vulputate elementum. Nullam varius.,11/8/2023,server,high,346,desktop,77742 Armistice Road,1131,Eddi Bruyntjes
