error_code,error_message,timestamp,source,severity,user_id,device_type,location,resolution_time,resolved_by
290,"Fusce lacus purus, aliquet at, feugiat non, pretium quis, lectus. Suspendisse potenti. In eleifend quam a odio. In hac habitasse platea dictumst. Maecenas ut massa quis augue luctus tincidunt. Nulla mollis molestie lorem. Quisque ut erat. Curabitur gravida nisi at nibh.",10/24/2024,client,high,506,desktop,2547 Gateway Center,950,Mayer Quade
914,"In sagittis dui vel nisl. Duis ac nibh. Fusce lacus purus, aliquet at, feugiat non, pretium quis, lectus. Suspendisse potenti. In eleifend quam a odio. In hac habitasse platea dictumst. Maecenas ut massa quis augue luctus tincidunt. Nulla mollis molestie lorem. Quisque ut erat.",8/2/2024,server,medium,507,mobile,237 Oriole Place,448,Mathias Cane
877,Suspendisse accumsan tortor quis turpis. Sed ante. Vivamus tortor.,2/18/2024,client,high,508,tablet,8 Rigney Avenue,1000,Odelia Gaylord
120,Mauris sit amet eros. Suspendisse accumsan tortor quis turpis. Sed ante. Vivamus tortor. Duis mattis egestas metus. Aenean fermentum.,12/20/2023,database,high,509,mobile,5 Huxley Drive,1085,Valentijn Banbridge
458,"Morbi sem mauris, laoreet ut, rhoncus aliquet, pulvinar sed, nisl. Nunc rhoncus dui vel sem. Sed sagittis. Nam congue, risus semper porta volutpat, quam pede lobortis ligula, sit amet eleifend pede libero quis orci. Nullam molestie nibh in lectus. Pellentesque at nulla. Suspendisse potenti.",8/31/2024,database,low,510,desktop,05454 Grim Point,5,Beaufort Shuard
754,Ut tellus. Nulla ut erat id mauris vulputate elementum. Nullam varius. Nulla facilisi. Cras non velit nec nisi vulputate nonummy.,5/24/2024,server,high,511,mobile,83 Gulseth Pass,130,Waly Wabersinke
448,"Aenean sit amet justo. Morbi ut odio. Cras mi pede, malesuada in, imperdiet et, commodo vulputate, justo. In blandit ultrices enim.",7/4/2024,server,high,512,desktop,52970 Brentwood Pass,1292,Rhianna Kobu
550,"Donec posuere metus vitae ipsum. Aliquam non mauris. Morbi non lectus. Aliquam sit amet diam in magna bibendum imperdiet. Nullam orci pede, venenatis non, sodales sed, tincidunt eu, felis. Fusce posuere felis sed lacus. Morbi sem mauris, laoreet ut, rhoncus aliquet, pulvinar sed, nisl.",8/10/2024,server,medium,513,mobile,57817 Crest Line Avenue,561,Nonie MacFall
181,"Integer pede justo, lacinia eget, tincidunt eget, tempus vel, pede. Morbi porttitor lorem id ligula. Suspendisse ornare consequat lectus. In est risus, auctor sed, tristique in, tempus sit amet, sem. Fusce consequat. Nulla nisl. Nunc nisl. Duis bibendum, felis sed interdum venenatis, turpis enim blandit mi, in porttitor pede justo eu massa.",11/29/2023,server,low,514,mobile,95001 Gina Circle,894,Brooks Thody
611,In eleifend quam a odio.,8/23/2024,database,high,515,desktop,343 Fair Oaks Crossing,118,Audie Amott
564,"Nulla nisl. Nunc nisl. Duis bibendum, felis sed interdum venenatis, turpis enim blandit mi, in porttitor pede justo eu massa. Donec dapibus. Duis at velit eu est congue elementum. In hac habitasse platea dictumst. Morbi vestibulum, velit id pretium iaculis, diam erat fermentum justo, nec condimentum neque sapien placerat ante. Nulla justo. Aliquam quis turpis eget elit sodales scelerisque. Mauris sit amet eros.",2/2/2024,client,low,516,desktop,19 Warbler Circle,1315,Buckie Ilden
500,In congue. Etiam justo. Etiam pretium iaculis justo. In hac habitasse platea dictumst. Etiam faucibus cursus urna. Ut tellus. Nulla ut erat id mauris vulputate elementum.,10/9/2023,server,low,517,desktop,96 Anzinger Street,533,Margie Creeber
164,Integer ac leo.,4/6/2024,client,low,518,mobile,2088 Talisman Trail,1242,Briny Taudevin
958,"Maecenas pulvinar lobortis est. Phasellus sit amet erat. Nulla tempus. Vivamus in felis eu sapien cursus vestibulum. Proin eu mi. Nulla ac enim. In tempor, turpis nec euismod scelerisque, quam turpis adipiscing lorem, vitae mattis nibh ligula nec sem. Duis aliquam convallis nunc. Proin at turpis a pede posuere nonummy. Integer non velit.",2/16/2024,database,low,519,desktop,409 Dixon Court,363,Rubetta Whatham
361,"Integer aliquet, massa id lobortis convallis, tortor risus dapibus augue, vel accumsan tellus nisi eu orci. Mauris lacinia sapien quis libero.",1/18/2024,client,high,520,mobile,5 Nancy Street,1151,Irving Steabler
876,Vestibulum ante ipsum primis in faucibus orci luctus et ultrices posuere cubilia Curae; Duis faucibus accumsan odio. Curabitur convallis. Duis consequat dui nec nisi volutpat eleifend. Donec ut dolor. Morbi vel lectus in quam fringilla rhoncus.,7/1/2024,database,high,521,mobile,82 Straubel Avenue,223,Jackelyn Dowey
129,"Donec odio justo, sollicitudin ut, suscipit a, feugiat et, eros. Vestibulum ac est lacinia nisi venenatis tristique. Fusce congue, diam id ornare imperdiet, sapien urna pretium nisl, ut volutpat sapien arcu sed augue. Aliquam erat volutpat.",4/22/2024,database,high,522,mobile,24703 Rieder Lane,1045,Janice Stonhewer
862,Etiam pretium iaculis justo. In hac habitasse platea dictumst. Etiam faucibus cursus urna. Ut tellus. Nulla ut erat id mauris vulputate elementum. Nullam varius.,7/14/2024,server,low,523,tablet,9753 Dexter Pass,850,Nevile Liddel
967,"Nam congue, risus semper porta volutpat, quam pede lobortis ligula, sit amet eleifend pede libero quis orci.",5/7/2024,server,high,524,tablet,291 Talisman Road,961,Foss Jobey
544,Nulla facilisi. Cras non velit nec nisi vulputate nonummy. Maecenas tincidunt lacus at velit.,11/21/2024,client,medium,525,mobile,999 Village Green Crossing,422,Christian Cutbirth
207,"Morbi sem mauris, laoreet ut, rhoncus aliquet, pulvinar sed, nisl. Nunc rhoncus dui vel sem. Sed sagittis. Nam congue, risus semper porta volutpat, quam pede lobortis ligula, sit amet eleifend pede libero quis orci.",10/4/2023,server,low,526,mobile,2156 Springview Lane,788,Hayes Fullalove
669,Integer ac neque. Duis bibendum. Morbi non quam nec dui luctus rutrum. Nulla tellus. In sagittis dui vel nisl. Duis ac nibh.,2/11/2024,server,high,527,desktop,097 Pawling Junction,742,Corri Bedin
198,Nulla facilisi. Cras non velit nec nisi vulputate nonummy.,1/24/2024,server,medium,528,mobile,997 Lunder Road,477,Nancy Dewane
668,"Vivamus tortor. Duis mattis egestas metus. Aenean fermentum. Donec ut mauris eget massa tempor convallis. Nulla neque libero, convallis eget, eleifend luctus, ultricies eu, nibh. Quisque id justo sit amet sapien dignissim vestibulum. Vestibulum ante ipsum primis in faucibus orci luctus et ultrices posuere cubilia Curae; Nulla dapibus dolor vel est. Donec odio justo, sollicitudin ut, suscipit a, feugiat et, eros. Vestibulum ac est lacinia nisi venenatis tristique. Fusce congue, diam id ornare imperdiet, sapien urna pretium nisl, ut volutpat sapien arcu sed augue.",2/17/2024,client,medium,529,desktop,1 Bay Pass,1423,Cody Terren
743,"Mauris enim leo, rhoncus sed, vestibulum sit amet, cursus id, turpis. Integer aliquet, massa id lobortis convallis, tortor risus dapibus augue, vel accumsan tellus nisi eu orci. Mauris lacinia sapien quis libero. Nullam sit amet turpis elementum ligula vehicula consequat.",11/6/2024,server,high,530,tablet,0 John Wall Junction,466,Haydon Kovelmann
894,"In sagittis dui vel nisl. Duis ac nibh. Fusce lacus purus, aliquet at, feugiat non, pretium quis, lectus.",5/31/2024,server,medium,531,tablet,6685 Anhalt Drive,880,Abramo Stuehmeyer
205,"Fusce lacus purus, aliquet at, feugiat non, pretium quis, lectus. Suspendisse potenti. In eleifend quam a odio. In hac habitasse platea dictumst. Maecenas ut massa quis augue luctus tincidunt. Nulla mollis molestie lorem. Quisque ut erat.",9/30/2024,server,high,532,tablet,2 Colorado Pass,567,Abelard Blanch
206,Nullam molestie nibh in lectus.,9/23/2024,database,medium,533,mobile,620 Holmberg Avenue,1262,Pincus Minithorpe
487,"Lorem ipsum dolor sit amet, consectetuer adipiscing elit. Proin interdum mauris non ligula pellentesque ultrices. Phasellus id sapien in sapien iaculis congue. Vivamus metus arcu, adipiscing molestie, hendrerit at, vulputate vitae, nisl. Aenean lectus. Pellentesque eget nunc. Donec quis orci eget orci vehicula condimentum. Curabitur in libero ut massa volutpat convallis.",7/19/2024,client,low,534,desktop,5635 Daystar Point,1096,Godart Dyke
264,Ut tellus. Nulla ut erat id mauris vulputate elementum. Nullam varius.,10/25/2023,client,low,535,mobile,8 Glacier Hill Place,1196,Maris Aulton
906,"Cum sociis natoque penatibus et magnis dis parturient montes, nascetur ridiculus mus.",7/19/2024,server,medium,536,mobile,76 Longview Terrace,139,Berkeley Hazelgreave
648,"Nulla nisl. Nunc nisl. Duis bibendum, felis sed interdum venenatis, turpis enim blandit mi, in porttitor pede justo eu massa. Donec dapibus. Duis at velit eu est congue elementum. In hac habitasse platea dictumst. Morbi vestibulum, velit id pretium iaculis, diam erat fermentum justo, nec condimentum neque sapien placerat ante. Nulla justo. Aliquam quis turpis eget elit sodales scelerisque. Mauris sit amet eros.",6/11/2024,client,low,537,desktop,5 Vahlen Lane,564,Arnuad Klemencic
916,Etiam pretium iaculis justo. In hac habitasse platea dictumst. Etiam faucibus cursus urna. Ut tellus. Nulla ut erat id mauris vulputate elementum.,10/13/2023,database,high,538,desktop,1098 Cordelia Trail,263,Reeta Anscombe
862,"Fusce congue, diam id ornare imperdiet, sapien urna pretium nisl, ut volutpat sapien arcu sed augue. Aliquam erat volutpat. In congue.",4/27/2024,database,low,539,tablet,8 Mallory Parkway,175,Anallise Windebank
663,Vivamus vestibulum sagittis sapien.,11/3/2023,server,medium,540,tablet,04870 Randy Park,574,Ellyn Timpany
467,In hac habitasse platea dictumst. Etiam faucibus cursus urna. Ut tellus. Nulla ut erat id mauris vulputate elementum. Nullam varius. Nulla facilisi.,10/1/2023,client,high,541,mobile,0315 3rd Drive,70,Jeff Patis
738,"Curabitur gravida nisi at nibh. In hac habitasse platea dictumst. Aliquam augue quam, sollicitudin vitae, consectetuer eget, rutrum at, lorem. Integer tincidunt ante vel ipsum. Praesent blandit lacinia erat. Vestibulum sed magna at nunc commodo placerat. Praesent blandit.",2/17/2024,client,low,542,desktop,8 Scofield Trail,1386,Beck Devoy
158,"Nam dui. Proin leo odio, porttitor id, consequat in, consequat ut, nulla. Sed accumsan felis. Ut at dolor quis odio consequat varius. Integer ac leo. Pellentesque ultrices mattis odio.",10/24/2023,database,low,543,mobile,291 Forest Run Terrace,272,Kathie Sprowell
235,Vestibulum sed magna at nunc commodo placerat. Praesent blandit. Nam nulla.,2/19/2024,server,medium,544,desktop,6 Londonderry Terrace,1106,Timmie Guidone
925,"Proin interdum mauris non ligula pellentesque ultrices. Phasellus id sapien in sapien iaculis congue. Vivamus metus arcu, adipiscing molestie, hendrerit at, vulputate vitae, nisl.",4/17/2024,client,high,545,tablet,454 Forest Junction,243,Joice Moyce
830,Suspendisse accumsan tortor quis turpis. Sed ante. Vivamus tortor.,9/30/2024,database,medium,546,mobile,63888 Kings Hill,573,Meagan Channon
467,"Lorem ipsum dolor sit amet, consectetuer adipiscing elit. Proin risus. Praesent lectus. Vestibulum quam sapien, varius ut, blandit non, interdum in, ante. Vestibulum ante ipsum primis in faucibus orci luctus et ultrices posuere cubilia Curae; Duis faucibus accumsan odio. Curabitur convallis. Duis consequat dui nec nisi volutpat eleifend. Donec ut dolor. Morbi vel lectus in quam fringilla rhoncus.",8/30/2024,client,high,547,mobile,1 Namekagon Road,1369,Preston Stanworth
661,Pellentesque eget nunc. Donec quis orci eget orci vehicula condimentum. Curabitur in libero ut massa volutpat convallis.,5/15/2024,client,medium,548,desktop,9 Grayhawk Parkway,163,Jorrie Stowte
917,In hac habitasse platea dictumst. Etiam faucibus cursus urna.,11/20/2023,server,low,549,tablet,9163 Farmco Park,379,Brooke MacPaike
701,"Aenean sit amet justo. Morbi ut odio. Cras mi pede, malesuada in, imperdiet et, commodo vulputate, justo. In blandit ultrices enim. Lorem ipsum dolor sit amet, consectetuer adipiscing elit. Proin interdum mauris non ligula pellentesque ultrices. Phasellus id sapien in sapien iaculis congue. Vivamus metus arcu, adipiscing molestie, hendrerit at, vulputate vitae, nisl.",11/6/2024,database,high,550,mobile,37119 Eagle Crest Place,805,Melly Downing
980,"Nulla tempus. Vivamus in felis eu sapien cursus vestibulum. Proin eu mi. Nulla ac enim. In tempor, turpis nec euismod scelerisque, quam turpis adipiscing lorem, vitae mattis nibh ligula nec sem. Duis aliquam convallis nunc. Proin at turpis a pede posuere nonummy. Integer non velit. Donec diam neque, vestibulum eget, vulputate ut, ultrices vel, augue. Vestibulum ante ipsum primis in faucibus orci luctus et ultrices posuere cubilia Curae; Donec pharetra, magna vestibulum aliquet ultrices, erat tortor sollicitudin mi, sit amet lobortis sapien sapien non mi.",11/15/2024,server,low,551,tablet,05 Pennsylvania Crossing,934,Ethelin Demcak
470,"Donec diam neque, vestibulum eget, vulputate ut, ultrices vel, augue. Vestibulum ante ipsum primis in faucibus orci luctus et ultrices posuere cubilia Curae; Donec pharetra, magna vestibulum aliquet ultrices, erat tortor sollicitudin mi, sit amet lobortis sapien sapien non mi.",4/2/2024,client,low,552,desktop,5475 Oriole Center,331,Kacie Gresswell
584,"Donec odio justo, sollicitudin ut, suscipit a, feugiat et, eros. Vestibulum ac est lacinia nisi venenatis tristique.",9/17/2024,database,high,553,mobile,67 Fisk Court,1124,Damon Brandsma
677,Aliquam erat volutpat. In congue. Etiam justo. Etiam pretium iaculis justo. In hac habitasse platea dictumst. Etiam faucibus cursus urna. Ut tellus.,7/3/2024,client,high,554,desktop,64 Sundown Road,1078,Hermina Irdale
160,Aenean lectus. Pellentesque eget nunc. Donec quis orci eget orci vehicula condimentum.,12/13/2023,server,low,555,desktop,4 Monica Way,1335,Hetty Perocci
840,Duis mattis egestas metus. Aenean fermentum.,1/27/2024,server,low,556,mobile,384 American Crossing,1308,Dorian Wager
787,"Nulla mollis molestie lorem. Quisque ut erat. Curabitur gravida nisi at nibh. In hac habitasse platea dictumst. Aliquam augue quam, sollicitudin vitae, consectetuer eget, rutrum at, lorem. Integer tincidunt ante vel ipsum. Praesent blandit lacinia erat. Vestibulum sed magna at nunc commodo placerat. Praesent blandit.",10/5/2024,database,low,557,desktop,3012 Johnson Crossing,760,Margarette Manie
183,In hac habitasse platea dictumst. Etiam faucibus cursus urna. Ut tellus. Nulla ut erat id mauris vulputate elementum. Nullam varius. Nulla facilisi. Cras non velit nec nisi vulputate nonummy. Maecenas tincidunt lacus at velit. Vivamus vel nulla eget eros elementum pellentesque.,1/21/2024,database,medium,558,mobile,54 Mendota Hill,1406,Michele Crummy
825,Nulla justo.,9/8/2024,server,medium,559,mobile,0016 Brickson Park Point,956,Ariana Screach
348,"Vivamus vel nulla eget eros elementum pellentesque. Quisque porta volutpat erat. Quisque erat eros, viverra eget, congue eget, semper rutrum, nulla.",10/20/2024,client,high,560,desktop,749 Banding Court,53,Elysia Quodling
731,"Lorem ipsum dolor sit amet, consectetuer adipiscing elit. Proin interdum mauris non ligula pellentesque ultrices. Phasellus id sapien in sapien iaculis congue. Vivamus metus arcu, adipiscing molestie, hendrerit at, vulputate vitae, nisl. Aenean lectus. Pellentesque eget nunc. Donec quis orci eget orci vehicula condimentum. Curabitur in libero ut massa volutpat convallis. Morbi odio odio, elementum eu, interdum eu, tincidunt in, leo. Maecenas pulvinar lobortis est.",8/20/2024,server,low,561,mobile,80 Express Crossing,791,Eleonora Spollen
674,"Vestibulum sed magna at nunc commodo placerat. Praesent blandit. Nam nulla. Integer pede justo, lacinia eget, tincidunt eget, tempus vel, pede. Morbi porttitor lorem id ligula. Suspendisse ornare consequat lectus. In est risus, auctor sed, tristique in, tempus sit amet, sem. Fusce consequat. Nulla nisl. Nunc nisl.",8/15/2024,database,high,562,tablet,013 Gateway Pass,797,Toni Bloodworth
123,"Sed accumsan felis. Ut at dolor quis odio consequat varius. Integer ac leo. Pellentesque ultrices mattis odio. Donec vitae nisi. Nam ultrices, libero non mattis pulvinar, nulla pede ullamcorper augue, a suscipit nulla elit ac nulla. Sed vel enim sit amet nunc viverra dapibus. Nulla suscipit ligula in lacus.",7/10/2024,database,medium,563,tablet,0242 Service Way,842,Slade Billo
944,Maecenas rhoncus aliquam lacus.,7/5/2024,server,high,564,mobile,166 Thierer Park,527,Linoel Eldin
250,Nam nulla.,11/7/2023,client,medium,565,desktop,56244 Anthes Place,803,Garrot Hammerson
282,"Integer pede justo, lacinia eget, tincidunt eget, tempus vel, pede. Morbi porttitor lorem id ligula. Suspendisse ornare consequat lectus. In est risus, auctor sed, tristique in, tempus sit amet, sem. Fusce consequat. Nulla nisl. Nunc nisl. Duis bibendum, felis sed interdum venenatis, turpis enim blandit mi, in porttitor pede justo eu massa. Donec dapibus. Duis at velit eu est congue elementum.",8/21/2024,client,high,566,desktop,77 Glacier Hill Park,551,Miller Stanger
547,"Aenean fermentum. Donec ut mauris eget massa tempor convallis. Nulla neque libero, convallis eget, eleifend luctus, ultricies eu, nibh.",5/22/2024,client,high,567,mobile,285 Golf Course Avenue,98,Bathsheba Billes
384,Mauris lacinia sapien quis libero. Nullam sit amet turpis elementum ligula vehicula consequat. Morbi a ipsum. Integer a nibh. In quis justo.,9/8/2024,server,medium,568,mobile,536 Atwood Center,506,Griff Goudie
434,"Donec vitae nisi. Nam ultrices, libero non mattis pulvinar, nulla pede ullamcorper augue, a suscipit nulla elit ac nulla. Sed vel enim sit amet nunc viverra dapibus. Nulla suscipit ligula in lacus.",3/31/2024,server,low,569,desktop,1 Magdeline Plaza,793,Freddy Heathcote
801,"Nullam molestie nibh in lectus. Pellentesque at nulla. Suspendisse potenti. Cras in purus eu magna vulputate luctus. Cum sociis natoque penatibus et magnis dis parturient montes, nascetur ridiculus mus. Vivamus vestibulum sagittis sapien. Cum sociis natoque penatibus et magnis dis parturient montes, nascetur ridiculus mus.",4/30/2024,database,low,570,mobile,72471 Hooker Alley,447,Mischa Mandre
812,Morbi porttitor lorem id ligula. Suspendisse ornare consequat lectus.,10/16/2023,client,high,571,tablet,694 Spenser Trail,570,Marybeth Linning
174,"Nulla mollis molestie lorem. Quisque ut erat. Curabitur gravida nisi at nibh. In hac habitasse platea dictumst. Aliquam augue quam, sollicitudin vitae, consectetuer eget, rutrum at, lorem. Integer tincidunt ante vel ipsum. Praesent blandit lacinia erat. Vestibulum sed magna at nunc commodo placerat. Praesent blandit.",10/18/2024,server,medium,572,mobile,6 Hanover Way,1425,Tanny Bowcock
778,"Aenean auctor gravida sem. Praesent id massa id nisl venenatis lacinia. Aenean sit amet justo. Morbi ut odio. Cras mi pede, malesuada in, imperdiet et, commodo vulputate, justo. In blandit ultrices enim. Lorem ipsum dolor sit amet, consectetuer adipiscing elit. Proin interdum mauris non ligula pellentesque ultrices. Phasellus id sapien in sapien iaculis congue.",9/13/2024,client,low,573,mobile,73 Mariners Cove Center,346,Hurley Hardstaff
959,"Fusce consequat. Nulla nisl. Nunc nisl. Duis bibendum, felis sed interdum venenatis, turpis enim blandit mi, in porttitor pede justo eu massa. Donec dapibus. Duis at velit eu est congue elementum. In hac habitasse platea dictumst. Morbi vestibulum, velit id pretium iaculis, diam erat fermentum justo, nec condimentum neque sapien placerat ante.",12/28/2023,server,low,574,tablet,818 Maryland Center,114,Angie Kemm
548,"Donec ut mauris eget massa tempor convallis. Nulla neque libero, convallis eget, eleifend luctus, ultricies eu, nibh.",10/24/2023,client,high,575,tablet,39 Mallard Terrace,641,Penelopa Beadle
501,Nulla ut erat id mauris vulputate elementum.,2/9/2024,server,medium,576,mobile,0 Pawling Point,1408,Evan Sammons
438,"Nam nulla. Integer pede justo, lacinia eget, tincidunt eget, tempus vel, pede. Morbi porttitor lorem id ligula. Suspendisse ornare consequat lectus. In est risus, auctor sed, tristique in, tempus sit amet, sem. Fusce consequat. Nulla nisl. Nunc nisl.",4/14/2024,server,low,577,mobile,76 Talmadge Pass,1143,Alfreda Buey
318,In congue. Etiam justo. Etiam pretium iaculis justo. In hac habitasse platea dictumst. Etiam faucibus cursus urna. Ut tellus. Nulla ut erat id mauris vulputate elementum. Nullam varius. Nulla facilisi. Cras non velit nec nisi vulputate nonummy.,2/29/2024,database,low,578,tablet,0776 Sunfield Alley,701,Jamaal Hilling
508,"Praesent blandit. Nam nulla. Integer pede justo, lacinia eget, tincidunt eget, tempus vel, pede. Morbi porttitor lorem id ligula.",11/16/2023,client,low,579,desktop,522 Summit Alley,1144,Aubrey Strutley
774,"Mauris enim leo, rhoncus sed, vestibulum sit amet, cursus id, turpis. Integer aliquet, massa id lobortis convallis, tortor risus dapibus augue, vel accumsan tellus nisi eu orci. Mauris lacinia sapien quis libero. Nullam sit amet turpis elementum ligula vehicula consequat. Morbi a ipsum. Integer a nibh. In quis justo.",12/22/2023,database,high,580,desktop,061 Logan Plaza,1045,Fae Laverick
602,"Phasellus id sapien in sapien iaculis congue. Vivamus metus arcu, adipiscing molestie, hendrerit at, vulputate vitae, nisl. Aenean lectus. Pellentesque eget nunc. Donec quis orci eget orci vehicula condimentum. Curabitur in libero ut massa volutpat convallis. Morbi odio odio, elementum eu, interdum eu, tincidunt in, leo.",2/9/2024,server,low,581,mobile,2697 Lighthouse Bay Court,334,Ralf Sayton
354,Morbi non quam nec dui luctus rutrum. Nulla tellus. In sagittis dui vel nisl. Duis ac nibh.,11/5/2024,client,high,582,mobile,51414 Forster Park,505,Randee Bibby
426,Aenean lectus. Pellentesque eget nunc. Donec quis orci eget orci vehicula condimentum. Curabitur in libero ut massa volutpat convallis.,1/7/2024,server,medium,583,mobile,7 Arkansas Court,488,Matthew Giddens
967,Vestibulum ante ipsum primis in faucibus orci luctus et ultrices posuere cubilia Curae; Mauris viverra diam vitae quam. Suspendisse potenti. Nullam porttitor lacus at turpis. Donec posuere metus vitae ipsum. Aliquam non mauris. Morbi non lectus. Aliquam sit amet diam in magna bibendum imperdiet.,3/11/2024,server,low,584,tablet,07053 7th Way,1364,Ransom Elfitt
884,"Morbi odio odio, elementum eu, interdum eu, tincidunt in, leo.",5/12/2024,server,low,585,mobile,81646 Amoth Circle,1324,Noach Gocher
351,"Integer a nibh. In quis justo. Maecenas rhoncus aliquam lacus. Morbi quis tortor id nulla ultrices aliquet. Maecenas leo odio, condimentum id, luctus nec, molestie sed, justo. Pellentesque viverra pede ac diam.",6/10/2024,client,low,586,tablet,511 Spohn Plaza,534,Dannye Beavers
918,"Proin interdum mauris non ligula pellentesque ultrices. Phasellus id sapien in sapien iaculis congue. Vivamus metus arcu, adipiscing molestie, hendrerit at, vulputate vitae, nisl. Aenean lectus. Pellentesque eget nunc. Donec quis orci eget orci vehicula condimentum. Curabitur in libero ut massa volutpat convallis. Morbi odio odio, elementum eu, interdum eu, tincidunt in, leo. Maecenas pulvinar lobortis est.",6/25/2024,server,medium,587,mobile,1897 1st Alley,828,Henrie Mottershead
422,"Proin eu mi. Nulla ac enim. In tempor, turpis nec euismod scelerisque, quam turpis adipiscing lorem, vitae mattis nibh ligula nec sem. Duis aliquam convallis nunc. Proin at turpis a pede posuere nonummy. Integer non velit.",10/12/2023,client,medium,588,desktop,58 Derek Terrace,1285,Gina Staries
926,"Lorem ipsum dolor sit amet, consectetuer adipiscing elit. Proin risus. Praesent lectus. Vestibulum quam sapien, varius ut, blandit non, interdum in, ante. Vestibulum ante ipsum primis in faucibus orci luctus et ultrices posuere cubilia Curae; Duis faucibus accumsan odio. Curabitur convallis. Duis consequat dui nec nisi volutpat eleifend. Donec ut dolor. Morbi vel lectus in quam fringilla rhoncus. Mauris enim leo, rhoncus sed, vestibulum sit amet, cursus id, turpis.",11/21/2024,client,medium,589,desktop,73 Badeau Plaza,1205,Ogdon Moorerud
828,"Vestibulum ante ipsum primis in faucibus orci luctus et ultrices posuere cubilia Curae; Mauris viverra diam vitae quam. Suspendisse potenti. Nullam porttitor lacus at turpis. Donec posuere metus vitae ipsum. Aliquam non mauris. Morbi non lectus. Aliquam sit amet diam in magna bibendum imperdiet. Nullam orci pede, venenatis non, sodales sed, tincidunt eu, felis. Fusce posuere felis sed lacus.",1/7/2024,client,medium,590,tablet,802 Derek Alley,344,Devora McDaid
799,In congue. Etiam justo. Etiam pretium iaculis justo. In hac habitasse platea dictumst. Etiam faucibus cursus urna. Ut tellus.,8/18/2024,client,medium,591,tablet,125 Moose Plaza,728,Bryanty Scramage
905,"Integer aliquet, massa id lobortis convallis, tortor risus dapibus augue, vel accumsan tellus nisi eu orci. Mauris lacinia sapien quis libero. Nullam sit amet turpis elementum ligula vehicula consequat. Morbi a ipsum. Integer a nibh. In quis justo. Maecenas rhoncus aliquam lacus.",9/14/2024,database,high,592,mobile,3869 Dottie Park,366,Guglielmo Eckley
136,Nulla ut erat id mauris vulputate elementum.,10/25/2023,server,low,593,desktop,0904 Northview Street,1386,Erich Bottlestone
784,Aliquam erat volutpat. In congue. Etiam justo. Etiam pretium iaculis justo. In hac habitasse platea dictumst. Etiam faucibus cursus urna. Ut tellus. Nulla ut erat id mauris vulputate elementum. Nullam varius. Nulla facilisi.,9/20/2024,server,medium,594,mobile,7 Vera Hill,117,Gray Mandel
825,Donec quis orci eget orci vehicula condimentum. Curabitur in libero ut massa volutpat convallis.,1/7/2024,server,medium,595,desktop,1051 Gulseth Terrace,130,Lew Matula
