error_code,error_message,timestamp,source,severity,user_id,device_type,location,resolution_time,resolved_by
607,"Morbi a ipsum. Integer a nibh. In quis justo. Maecenas rhoncus aliquam lacus. Morbi quis tortor id nulla ultrices aliquet. Maecenas leo odio, condimentum id, luctus nec, molestie sed, justo.",3/25/2024,database,medium,689,mobile,14 Del Sol Plaza,755,Eldredge Rodolf
582,"In hac habitasse platea dictumst. Morbi vestibulum, velit id pretium iaculis, diam erat fermentum justo, nec condimentum neque sapien placerat ante. Nulla justo. Aliquam quis turpis eget elit sodales scelerisque. Mauris sit amet eros.",5/25/2024,database,low,690,tablet,91 Graedel Terrace,5,Jonah Wildsmith
831,"Nullam porttitor lacus at turpis. Donec posuere metus vitae ipsum. Aliquam non mauris. Morbi non lectus. Aliquam sit amet diam in magna bibendum imperdiet. Nullam orci pede, venenatis non, sodales sed, tincidunt eu, felis. Fusce posuere felis sed lacus. Morbi sem mauris, laoreet ut, rhoncus aliquet, pulvinar sed, nisl. Nunc rhoncus dui vel sem. Sed sagittis.",8/8/2024,database,medium,691,tablet,9283 Crescent Oaks Parkway,309,Bernadine Shwenn
280,"Donec posuere metus vitae ipsum. Aliquam non mauris. Morbi non lectus. Aliquam sit amet diam in magna bibendum imperdiet. Nullam orci pede, venenatis non, sodales sed, tincidunt eu, felis. Fusce posuere felis sed lacus. Morbi sem mauris, laoreet ut, rhoncus aliquet, pulvinar sed, nisl. Nunc rhoncus dui vel sem. Sed sagittis.",1/8/2024,server,high,692,desktop,8 Gulseth Alley,348,Cristin Machans
295,Vivamus vel nulla eget eros elementum pellentesque.,3/31/2024,client,high,693,mobile,6 Meadow Vale Road,1081,Tedie Bythway
387,"Donec posuere metus vitae ipsum. Aliquam non mauris. Morbi non lectus. Aliquam sit amet diam in magna bibendum imperdiet. Nullam orci pede, venenatis non, sodales sed, tincidunt eu, felis.",11/14/2023,database,high,694,mobile,30 Mccormick Junction,294,Hazel Casarili
985,"Vestibulum quam sapien, varius ut, blandit non, interdum in, ante. Vestibulum ante ipsum primis in faucibus orci luctus et ultrices posuere cubilia Curae; Duis faucibus accumsan odio. Curabitur convallis. Duis consequat dui nec nisi volutpat eleifend.",8/10/2024,client,low,695,desktop,8 Talisman Trail,1090,Bettye Pheasant
857,Nullam molestie nibh in lectus. Pellentesque at nulla. Suspendisse potenti. Cras in purus eu magna vulputate luctus.,9/17/2024,server,high,696,mobile,4 Little Fleur Trail,1364,Lucian Hartas
630,"Aliquam augue quam, sollicitudin vitae, consectetuer eget, rutrum at, lorem. Integer tincidunt ante vel ipsum. Praesent blandit lacinia erat. Vestibulum sed magna at nunc commodo placerat.",5/18/2024,database,high,697,tablet,75705 Grover Circle,1112,Doyle Dobbie
406,"Nunc nisl. Duis bibendum, felis sed interdum venenatis, turpis enim blandit mi, in porttitor pede justo eu massa. Donec dapibus. Duis at velit eu est congue elementum. In hac habitasse platea dictumst. Morbi vestibulum, velit id pretium iaculis, diam erat fermentum justo, nec condimentum neque sapien placerat ante. Nulla justo.",11/23/2023,database,medium,698,tablet,711 Cambridge Place,327,Dulsea Darch
243,"In quis justo. Maecenas rhoncus aliquam lacus. Morbi quis tortor id nulla ultrices aliquet. Maecenas leo odio, condimentum id, luctus nec, molestie sed, justo. Pellentesque viverra pede ac diam. Cras pellentesque volutpat dui. Maecenas tristique, est et tempus semper, est quam pharetra magna, ac consequat metus sapien ut nunc. Vestibulum ante ipsum primis in faucibus orci luctus et ultrices posuere cubilia Curae; Mauris viverra diam vitae quam. Suspendisse potenti.",11/22/2024,client,high,699,desktop,535 Little Fleur Court,1265,Denni Falconbridge
406,"Duis aliquam convallis nunc. Proin at turpis a pede posuere nonummy. Integer non velit. Donec diam neque, vestibulum eget, vulputate ut, ultrices vel, augue. Vestibulum ante ipsum primis in faucibus orci luctus et ultrices posuere cubilia Curae; Donec pharetra, magna vestibulum aliquet ultrices, erat tortor sollicitudin mi, sit amet lobortis sapien sapien non mi. Integer ac neque.",9/9/2024,server,high,700,tablet,6 Helena Park,112,Dunc Trulock
430,Integer ac leo. Pellentesque ultrices mattis odio. Donec vitae nisi.,5/9/2024,server,high,701,mobile,0 Quincy Court,130,Helge Rishman
590,Nullam sit amet turpis elementum ligula vehicula consequat. Morbi a ipsum. Integer a nibh.,9/3/2024,database,medium,702,tablet,5198 Roxbury Plaza,1333,Carole Gyorffy
430,Proin risus. Praesent lectus.,10/19/2024,server,low,703,desktop,996 Dottie Hill,371,Glad Gapper
550,Integer a nibh. In quis justo.,3/10/2024,client,high,704,tablet,7 Coolidge Court,1120,Caria Allgood
214,Nulla justo. Aliquam quis turpis eget elit sodales scelerisque. Mauris sit amet eros. Suspendisse accumsan tortor quis turpis. Sed ante. Vivamus tortor.,9/28/2024,server,high,705,tablet,27195 Starling Trail,283,Page Beetham
450,Maecenas tincidunt lacus at velit. Vivamus vel nulla eget eros elementum pellentesque. Quisque porta volutpat erat.,1/2/2024,server,low,706,tablet,9 Manufacturers Center,359,Serene Dobel
717,"Vestibulum sed magna at nunc commodo placerat. Praesent blandit. Nam nulla. Integer pede justo, lacinia eget, tincidunt eget, tempus vel, pede. Morbi porttitor lorem id ligula. Suspendisse ornare consequat lectus. In est risus, auctor sed, tristique in, tempus sit amet, sem. Fusce consequat. Nulla nisl. Nunc nisl.",1/30/2024,database,low,707,desktop,8 Independence Drive,510,Zeb Raittie
228,"Maecenas rhoncus aliquam lacus. Morbi quis tortor id nulla ultrices aliquet. Maecenas leo odio, condimentum id, luctus nec, molestie sed, justo. Pellentesque viverra pede ac diam. Cras pellentesque volutpat dui.",4/5/2024,client,medium,708,mobile,559 Katie Junction,56,Florie Doldon
977,"Nulla tempus. Vivamus in felis eu sapien cursus vestibulum. Proin eu mi. Nulla ac enim. In tempor, turpis nec euismod scelerisque, quam turpis adipiscing lorem, vitae mattis nibh ligula nec sem. Duis aliquam convallis nunc. Proin at turpis a pede posuere nonummy. Integer non velit. Donec diam neque, vestibulum eget, vulputate ut, ultrices vel, augue.",8/17/2024,database,medium,709,tablet,823 Carpenter Way,874,Jacquelin Ogelbe
486,"Nulla mollis molestie lorem. Quisque ut erat. Curabitur gravida nisi at nibh. In hac habitasse platea dictumst. Aliquam augue quam, sollicitudin vitae, consectetuer eget, rutrum at, lorem. Integer tincidunt ante vel ipsum. Praesent blandit lacinia erat. Vestibulum sed magna at nunc commodo placerat. Praesent blandit. Nam nulla.",11/9/2024,server,medium,710,mobile,20994 Eastlawn Way,897,Brod Joscelyne
473,"Proin interdum mauris non ligula pellentesque ultrices. Phasellus id sapien in sapien iaculis congue. Vivamus metus arcu, adipiscing molestie, hendrerit at, vulputate vitae, nisl. Aenean lectus.",11/21/2024,database,medium,711,tablet,2276 East Crossing,1290,Arvie Bartolomeazzi
426,"Pellentesque viverra pede ac diam. Cras pellentesque volutpat dui. Maecenas tristique, est et tempus semper, est quam pharetra magna, ac consequat metus sapien ut nunc. Vestibulum ante ipsum primis in faucibus orci luctus et ultrices posuere cubilia Curae; Mauris viverra diam vitae quam. Suspendisse potenti.",10/27/2023,server,medium,712,tablet,377 Fuller Junction,346,Freddy Holt
811,Nullam sit amet turpis elementum ligula vehicula consequat. Morbi a ipsum. Integer a nibh. In quis justo. Maecenas rhoncus aliquam lacus.,10/22/2023,server,medium,713,desktop,69 Arrowood Center,1045,Pauline Bragg
392,"Integer ac neque. Duis bibendum. Morbi non quam nec dui luctus rutrum. Nulla tellus. In sagittis dui vel nisl. Duis ac nibh. Fusce lacus purus, aliquet at, feugiat non, pretium quis, lectus. Suspendisse potenti.",3/14/2024,client,low,714,tablet,41 Blue Bill Park Road,963,Carmella Latus
179,"Nulla tempus. Vivamus in felis eu sapien cursus vestibulum. Proin eu mi. Nulla ac enim. In tempor, turpis nec euismod scelerisque, quam turpis adipiscing lorem, vitae mattis nibh ligula nec sem. Duis aliquam convallis nunc. Proin at turpis a pede posuere nonummy. Integer non velit. Donec diam neque, vestibulum eget, vulputate ut, ultrices vel, augue. Vestibulum ante ipsum primis in faucibus orci luctus et ultrices posuere cubilia Curae; Donec pharetra, magna vestibulum aliquet ultrices, erat tortor sollicitudin mi, sit amet lobortis sapien sapien non mi.",11/3/2023,client,medium,715,tablet,73313 Clyde Gallagher Place,357,Clemmy Shillabear
110,"Maecenas pulvinar lobortis est. Phasellus sit amet erat. Nulla tempus. Vivamus in felis eu sapien cursus vestibulum. Proin eu mi. Nulla ac enim. In tempor, turpis nec euismod scelerisque, quam turpis adipiscing lorem, vitae mattis nibh ligula nec sem. Duis aliquam convallis nunc. Proin at turpis a pede posuere nonummy.",6/4/2024,server,high,716,mobile,2941 Burning Wood Place,240,Breanne Slogrove
854,"Mauris enim leo, rhoncus sed, vestibulum sit amet, cursus id, turpis. Integer aliquet, massa id lobortis convallis, tortor risus dapibus augue, vel accumsan tellus nisi eu orci. Mauris lacinia sapien quis libero. Nullam sit amet turpis elementum ligula vehicula consequat. Morbi a ipsum. Integer a nibh. In quis justo.",10/5/2024,server,high,717,desktop,31 Pawling Crossing,914,Tedie Tampin
183,Suspendisse potenti. Nullam porttitor lacus at turpis.,1/14/2024,server,high,718,tablet,478 Glendale Road,507,Elfie Strognell
911,Suspendisse potenti.,6/25/2024,client,medium,719,desktop,759 Vahlen Pass,90,Mick Halwill
839,"Duis bibendum, felis sed interdum venenatis, turpis enim blandit mi, in porttitor pede justo eu massa. Donec dapibus. Duis at velit eu est congue elementum. In hac habitasse platea dictumst. Morbi vestibulum, velit id pretium iaculis, diam erat fermentum justo, nec condimentum neque sapien placerat ante.",10/14/2023,database,high,720,tablet,61864 Kensington Lane,1206,Madalyn Smalcombe
855,In hac habitasse platea dictumst. Etiam faucibus cursus urna. Ut tellus.,10/3/2023,database,medium,721,tablet,23 Mitchell Point,85,Lennie Grimley
409,"Suspendisse ornare consequat lectus. In est risus, auctor sed, tristique in, tempus sit amet, sem. Fusce consequat. Nulla nisl. Nunc nisl.",6/4/2024,client,low,722,mobile,05 Memorial Pass,282,Jay Noweak
382,Nulla tellus.,12/2/2023,server,high,723,tablet,00470 Badeau Trail,515,Hewitt Hindrich
613,Nullam varius. Nulla facilisi.,6/1/2024,server,high,724,desktop,5262 Granby Trail,408,Merwyn Fenemore
841,"Proin interdum mauris non ligula pellentesque ultrices. Phasellus id sapien in sapien iaculis congue. Vivamus metus arcu, adipiscing molestie, hendrerit at, vulputate vitae, nisl. Aenean lectus. Pellentesque eget nunc.",5/30/2024,client,high,725,desktop,6064 Glacier Hill Drive,412,Kiersten Sidon
364,Nulla justo. Aliquam quis turpis eget elit sodales scelerisque. Mauris sit amet eros. Suspendisse accumsan tortor quis turpis. Sed ante. Vivamus tortor. Duis mattis egestas metus.,7/16/2024,server,low,726,desktop,8007 Columbus Court,654,Kessiah De Winton
232,"Suspendisse ornare consequat lectus. In est risus, auctor sed, tristique in, tempus sit amet, sem. Fusce consequat. Nulla nisl. Nunc nisl. Duis bibendum, felis sed interdum venenatis, turpis enim blandit mi, in porttitor pede justo eu massa. Donec dapibus. Duis at velit eu est congue elementum. In hac habitasse platea dictumst.",2/3/2024,client,high,727,mobile,1831 School Center,322,Robina Hardin
758,In blandit ultrices enim.,11/9/2023,database,medium,728,tablet,20920 Crownhardt Way,525,Huey Heffron
974,"Morbi odio odio, elementum eu, interdum eu, tincidunt in, leo. Maecenas pulvinar lobortis est. Phasellus sit amet erat. Nulla tempus. Vivamus in felis eu sapien cursus vestibulum. Proin eu mi. Nulla ac enim. In tempor, turpis nec euismod scelerisque, quam turpis adipiscing lorem, vitae mattis nibh ligula nec sem.",6/9/2024,server,medium,729,tablet,263 New Castle Point,475,Aurel Birchwood
300,"In quis justo. Maecenas rhoncus aliquam lacus. Morbi quis tortor id nulla ultrices aliquet. Maecenas leo odio, condimentum id, luctus nec, molestie sed, justo. Pellentesque viverra pede ac diam.",2/5/2024,database,medium,730,mobile,55 Cardinal Center,231,York O' Kelleher
113,"Duis mattis egestas metus. Aenean fermentum. Donec ut mauris eget massa tempor convallis. Nulla neque libero, convallis eget, eleifend luctus, ultricies eu, nibh. Quisque id justo sit amet sapien dignissim vestibulum.",6/4/2024,database,low,731,tablet,012 Moland Terrace,1035,Barney Imesson
605,"Pellentesque ultrices mattis odio. Donec vitae nisi. Nam ultrices, libero non mattis pulvinar, nulla pede ullamcorper augue, a suscipit nulla elit ac nulla. Sed vel enim sit amet nunc viverra dapibus.",11/14/2024,client,low,732,tablet,8 Cordelia Center,8,Skipp Dickson
288,Vestibulum rutrum rutrum neque. Aenean auctor gravida sem.,7/31/2024,server,high,733,mobile,4 Glacier Hill Center,318,Ker Espinho
755,Nullam sit amet turpis elementum ligula vehicula consequat. Morbi a ipsum.,12/25/2023,database,high,734,desktop,205 Reinke Way,716,Rory Romeril
725,"Duis mattis egestas metus. Aenean fermentum. Donec ut mauris eget massa tempor convallis. Nulla neque libero, convallis eget, eleifend luctus, ultricies eu, nibh.",4/17/2024,database,high,735,desktop,1904 Sugar Plaza,821,Tabatha Marran
383,Maecenas rhoncus aliquam lacus. Morbi quis tortor id nulla ultrices aliquet.,3/8/2024,server,medium,736,mobile,277 Cardinal Hill,615,Joann Gebhardt
378,"Phasellus id sapien in sapien iaculis congue. Vivamus metus arcu, adipiscing molestie, hendrerit at, vulputate vitae, nisl. Aenean lectus. Pellentesque eget nunc. Donec quis orci eget orci vehicula condimentum. Curabitur in libero ut massa volutpat convallis. Morbi odio odio, elementum eu, interdum eu, tincidunt in, leo. Maecenas pulvinar lobortis est. Phasellus sit amet erat.",7/26/2024,database,high,737,mobile,37 Del Mar Court,477,Wye Livzey
269,"Vivamus tortor. Duis mattis egestas metus. Aenean fermentum. Donec ut mauris eget massa tempor convallis. Nulla neque libero, convallis eget, eleifend luctus, ultricies eu, nibh.",10/8/2024,server,low,738,mobile,33369 Red Cloud Circle,919,Mac Kirrens
366,"Aenean fermentum. Donec ut mauris eget massa tempor convallis. Nulla neque libero, convallis eget, eleifend luctus, ultricies eu, nibh. Quisque id justo sit amet sapien dignissim vestibulum.",3/14/2024,database,medium,739,tablet,94 Pankratz Plaza,795,Leicester Gateley
971,"Praesent blandit lacinia erat. Vestibulum sed magna at nunc commodo placerat. Praesent blandit. Nam nulla. Integer pede justo, lacinia eget, tincidunt eget, tempus vel, pede.",4/11/2024,client,high,740,desktop,7 Moland Park,604,Cherin Gravenall
936,"Aliquam augue quam, sollicitudin vitae, consectetuer eget, rutrum at, lorem. Integer tincidunt ante vel ipsum. Praesent blandit lacinia erat. Vestibulum sed magna at nunc commodo placerat. Praesent blandit.",11/4/2024,server,medium,741,tablet,7195 Ilene Plaza,266,Theadora Pidgley
902,Nunc rhoncus dui vel sem.,9/8/2024,client,high,742,desktop,88 Sugar Trail,533,Annice Hornung
138,"Cras non velit nec nisi vulputate nonummy. Maecenas tincidunt lacus at velit. Vivamus vel nulla eget eros elementum pellentesque. Quisque porta volutpat erat. Quisque erat eros, viverra eget, congue eget, semper rutrum, nulla. Nunc purus.",6/20/2024,database,high,743,tablet,1676 Farmco Center,1265,Mignonne O'Hannen
639,"Morbi quis tortor id nulla ultrices aliquet. Maecenas leo odio, condimentum id, luctus nec, molestie sed, justo. Pellentesque viverra pede ac diam. Cras pellentesque volutpat dui. Maecenas tristique, est et tempus semper, est quam pharetra magna, ac consequat metus sapien ut nunc.",10/12/2024,server,high,744,tablet,476 Columbus Hill,33,Kiersten Bydaway
348,Nullam molestie nibh in lectus.,2/13/2024,database,medium,745,mobile,88638 Meadow Vale Lane,851,Erda Broggini
153,"Morbi vel lectus in quam fringilla rhoncus. Mauris enim leo, rhoncus sed, vestibulum sit amet, cursus id, turpis. Integer aliquet, massa id lobortis convallis, tortor risus dapibus augue, vel accumsan tellus nisi eu orci. Mauris lacinia sapien quis libero. Nullam sit amet turpis elementum ligula vehicula consequat. Morbi a ipsum. Integer a nibh. In quis justo. Maecenas rhoncus aliquam lacus.",2/23/2024,client,high,746,desktop,104 Hudson Way,889,Jonathon Limbert
906,"Nulla neque libero, convallis eget, eleifend luctus, ultricies eu, nibh. Quisque id justo sit amet sapien dignissim vestibulum. Vestibulum ante ipsum primis in faucibus orci luctus et ultrices posuere cubilia Curae; Nulla dapibus dolor vel est. Donec odio justo, sollicitudin ut, suscipit a, feugiat et, eros. Vestibulum ac est lacinia nisi venenatis tristique. Fusce congue, diam id ornare imperdiet, sapien urna pretium nisl, ut volutpat sapien arcu sed augue. Aliquam erat volutpat. In congue.",1/21/2024,client,medium,747,mobile,3 Prentice Place,1138,Angy Geck
456,"Quisque porta volutpat erat. Quisque erat eros, viverra eget, congue eget, semper rutrum, nulla. Nunc purus. Phasellus in felis. Donec semper sapien a libero. Nam dui. Proin leo odio, porttitor id, consequat in, consequat ut, nulla. Sed accumsan felis. Ut at dolor quis odio consequat varius.",6/1/2024,client,high,748,desktop,96475 Jana Point,1117,Erl Matteo
177,Ut tellus. Nulla ut erat id mauris vulputate elementum.,4/27/2024,server,high,749,mobile,99593 Westport Lane,77,Kimbra Supple
630,"Maecenas leo odio, condimentum id, luctus nec, molestie sed, justo. Pellentesque viverra pede ac diam. Cras pellentesque volutpat dui. Maecenas tristique, est et tempus semper, est quam pharetra magna, ac consequat metus sapien ut nunc. Vestibulum ante ipsum primis in faucibus orci luctus et ultrices posuere cubilia Curae; Mauris viverra diam vitae quam. Suspendisse potenti. Nullam porttitor lacus at turpis. Donec posuere metus vitae ipsum. Aliquam non mauris.",11/15/2024,database,medium,750,tablet,2 South Lane,782,Doralia Wenzel
560,"Morbi sem mauris, laoreet ut, rhoncus aliquet, pulvinar sed, nisl. Nunc rhoncus dui vel sem. Sed sagittis. Nam congue, risus semper porta volutpat, quam pede lobortis ligula, sit amet eleifend pede libero quis orci.",3/14/2024,client,medium,751,tablet,9054 Old Gate Circle,273,Andrus Daintrey
316,"Duis bibendum, felis sed interdum venenatis, turpis enim blandit mi, in porttitor pede justo eu massa. Donec dapibus. Duis at velit eu est congue elementum. In hac habitasse platea dictumst. Morbi vestibulum, velit id pretium iaculis, diam erat fermentum justo, nec condimentum neque sapien placerat ante. Nulla justo.",3/1/2024,database,low,752,desktop,68314 Evergreen Plaza,1084,Katine Bottomley
560,"Quisque porta volutpat erat. Quisque erat eros, viverra eget, congue eget, semper rutrum, nulla. Nunc purus. Phasellus in felis. Donec semper sapien a libero. Nam dui. Proin leo odio, porttitor id, consequat in, consequat ut, nulla. Sed accumsan felis. Ut at dolor quis odio consequat varius. Integer ac leo.",8/30/2024,database,high,753,tablet,0 Farwell Parkway,942,Milty Norrington
654,Mauris sit amet eros. Suspendisse accumsan tortor quis turpis. Sed ante. Vivamus tortor.,5/19/2024,database,high,754,desktop,300 Calypso Alley,7,Stafford McOrkil
234,Praesent id massa id nisl venenatis lacinia. Aenean sit amet justo. Morbi ut odio.,11/26/2023,client,high,755,desktop,92531 Hayes Way,1141,Ilysa Kobke
534,In sagittis dui vel nisl.,1/12/2024,database,low,756,desktop,69366 Manufacturers Street,1177,Quintus Berryann
861,Morbi porttitor lorem id ligula. Suspendisse ornare consequat lectus.,10/18/2024,server,low,757,desktop,0994 American Street,719,Gregor Lappine
889,In sagittis dui vel nisl. Duis ac nibh.,11/13/2023,client,low,758,tablet,71472 Crowley Drive,1340,Ely Bracknell
970,"Morbi vestibulum, velit id pretium iaculis, diam erat fermentum justo, nec condimentum neque sapien placerat ante. Nulla justo. Aliquam quis turpis eget elit sodales scelerisque. Mauris sit amet eros. Suspendisse accumsan tortor quis turpis.",7/26/2024,client,low,759,mobile,52 South Avenue,288,Fletcher Litt
889,"Lorem ipsum dolor sit amet, consectetuer adipiscing elit.",11/11/2023,client,low,760,desktop,677 Westerfield Parkway,1220,Micky Chasmoor
391,In eleifend quam a odio.,2/12/2024,database,high,761,tablet,58541 Judy Parkway,573,Brander Byass
394,"Duis consequat dui nec nisi volutpat eleifend. Donec ut dolor. Morbi vel lectus in quam fringilla rhoncus. Mauris enim leo, rhoncus sed, vestibulum sit amet, cursus id, turpis. Integer aliquet, massa id lobortis convallis, tortor risus dapibus augue, vel accumsan tellus nisi eu orci. Mauris lacinia sapien quis libero. Nullam sit amet turpis elementum ligula vehicula consequat. Morbi a ipsum.",1/30/2024,server,medium,762,desktop,0 Arkansas Park,1175,Peder Knox
623,In congue. Etiam justo. Etiam pretium iaculis justo. In hac habitasse platea dictumst. Etiam faucibus cursus urna. Ut tellus. Nulla ut erat id mauris vulputate elementum.,11/30/2023,client,medium,763,tablet,48 Dwight Park,1216,Ardith Samuel
761,"Cras mi pede, malesuada in, imperdiet et, commodo vulputate, justo. In blandit ultrices enim. Lorem ipsum dolor sit amet, consectetuer adipiscing elit. Proin interdum mauris non ligula pellentesque ultrices. Phasellus id sapien in sapien iaculis congue. Vivamus metus arcu, adipiscing molestie, hendrerit at, vulputate vitae, nisl. Aenean lectus. Pellentesque eget nunc.",12/17/2023,server,high,764,desktop,4667 Gulseth Road,581,Markus Rubenov
397,Morbi non lectus. Aliquam sit amet diam in magna bibendum imperdiet.,3/11/2024,client,high,765,mobile,1792 Heffernan Lane,780,Marielle Pickin
920,"Duis bibendum. Morbi non quam nec dui luctus rutrum. Nulla tellus. In sagittis dui vel nisl. Duis ac nibh. Fusce lacus purus, aliquet at, feugiat non, pretium quis, lectus. Suspendisse potenti.",8/23/2024,client,medium,766,tablet,393 Lerdahl Pass,988,Gertie O' Borne
646,"Aenean fermentum. Donec ut mauris eget massa tempor convallis. Nulla neque libero, convallis eget, eleifend luctus, ultricies eu, nibh.",10/12/2023,database,high,767,desktop,365 East Alley,629,Lukas Dwelling
841,"Fusce congue, diam id ornare imperdiet, sapien urna pretium nisl, ut volutpat sapien arcu sed augue. Aliquam erat volutpat. In congue. Etiam justo. Etiam pretium iaculis justo.",3/6/2024,database,medium,768,tablet,67 Melody Trail,151,Rudiger Harrill
191,Etiam pretium iaculis justo. In hac habitasse platea dictumst. Etiam faucibus cursus urna. Ut tellus. Nulla ut erat id mauris vulputate elementum.,6/15/2024,client,high,769,desktop,2346 Michigan Crossing,1072,Charmion Perse
730,"Vivamus vestibulum sagittis sapien. Cum sociis natoque penatibus et magnis dis parturient montes, nascetur ridiculus mus. Etiam vel augue. Vestibulum rutrum rutrum neque. Aenean auctor gravida sem. Praesent id massa id nisl venenatis lacinia.",7/13/2024,database,low,770,mobile,42 Buena Vista Crossing,388,Emilie Barlace
374,"Nullam molestie nibh in lectus. Pellentesque at nulla. Suspendisse potenti. Cras in purus eu magna vulputate luctus. Cum sociis natoque penatibus et magnis dis parturient montes, nascetur ridiculus mus. Vivamus vestibulum sagittis sapien. Cum sociis natoque penatibus et magnis dis parturient montes, nascetur ridiculus mus. Etiam vel augue.",4/15/2024,client,medium,771,desktop,7 Kinsman Way,779,Willem Dorkins
617,"Nam ultrices, libero non mattis pulvinar, nulla pede ullamcorper augue, a suscipit nulla elit ac nulla. Sed vel enim sit amet nunc viverra dapibus. Nulla suscipit ligula in lacus. Curabitur at ipsum ac tellus semper interdum. Mauris ullamcorper purus sit amet nulla. Quisque arcu libero, rutrum ac, lobortis vel, dapibus at, diam. Nam tristique tortor eu pede.",3/22/2024,database,medium,772,mobile,322 Bowman Point,398,Jodie Corrin
214,"In tempor, turpis nec euismod scelerisque, quam turpis adipiscing lorem, vitae mattis nibh ligula nec sem. Duis aliquam convallis nunc. Proin at turpis a pede posuere nonummy. Integer non velit.",11/26/2023,server,high,773,desktop,9261 Lyons Junction,1003,Nina Stobbs
805,"In quis justo. Maecenas rhoncus aliquam lacus. Morbi quis tortor id nulla ultrices aliquet. Maecenas leo odio, condimentum id, luctus nec, molestie sed, justo. Pellentesque viverra pede ac diam. Cras pellentesque volutpat dui. Maecenas tristique, est et tempus semper, est quam pharetra magna, ac consequat metus sapien ut nunc.",8/10/2024,database,low,774,mobile,5871 Del Sol Circle,506,Wenonah Sego
160,"Quisque erat eros, viverra eget, congue eget, semper rutrum, nulla. Nunc purus. Phasellus in felis.",3/5/2024,server,medium,775,desktop,217 Merchant Way,1149,Lettie Pocknell
505,"Proin interdum mauris non ligula pellentesque ultrices. Phasellus id sapien in sapien iaculis congue. Vivamus metus arcu, adipiscing molestie, hendrerit at, vulputate vitae, nisl. Aenean lectus. Pellentesque eget nunc. Donec quis orci eget orci vehicula condimentum. Curabitur in libero ut massa volutpat convallis. Morbi odio odio, elementum eu, interdum eu, tincidunt in, leo. Maecenas pulvinar lobortis est.",7/24/2024,server,medium,776,desktop,83 Maple Court,1171,Kiley Rawll
192,"Aenean lectus. Pellentesque eget nunc. Donec quis orci eget orci vehicula condimentum. Curabitur in libero ut massa volutpat convallis. Morbi odio odio, elementum eu, interdum eu, tincidunt in, leo. Maecenas pulvinar lobortis est. Phasellus sit amet erat. Nulla tempus. Vivamus in felis eu sapien cursus vestibulum.",3/30/2024,client,medium,777,tablet,9 Northland Street,1153,Durward Costley
365,"Pellentesque at nulla. Suspendisse potenti. Cras in purus eu magna vulputate luctus. Cum sociis natoque penatibus et magnis dis parturient montes, nascetur ridiculus mus. Vivamus vestibulum sagittis sapien. Cum sociis natoque penatibus et magnis dis parturient montes, nascetur ridiculus mus. Etiam vel augue. Vestibulum rutrum rutrum neque. Aenean auctor gravida sem. Praesent id massa id nisl venenatis lacinia.",10/14/2024,server,medium,778,mobile,3354 Rutledge Street,232,Hebert Verdie
